goal_id,goal_title,goal_name,description,category,difficulty_level,typical_duration,tags
1,Grade Booster,Improve GPA,Work towards raising overall academic performance,Academic,Medium,3 months,"study,grades,academic"
2,Master's Foundation,Master a specific subject,Become proficient in a particular course or subject area,Academic,Medium,3 months,"learning,subject mastery,academic"
3,Study Squad Captain,Develop better study habits,Create and maintain effective study routines,Academic,Easy,1 month,"productivity,study skills,habits"
4,Thesis Titan,Complete thesis/capstone project,Successfully finish final year research or project,Academic,Hard,1 year,"research,writing,project management"
5,Code Commander,Learn a new programming language,Gain proficiency in coding with a new language,Academic,Medium,3 months,"coding,technology,skills"
6,Dean's List Achiever,Achieve dean's list,Earn recognition for academic excellence,Academic,Hard,3 months,"academic,achievement,grades"
7,Attendance Hero,Attend all classes,Maintain perfect attendance,Academic,Easy,3 months,"discipline,academic,commitment"
8,Bookworm Challenge,Read more books,Expand knowledge through regular reading,Academic,Easy,3 months,"reading,learning,knowledge"
9,Time Master,Improve time management,Better organize academic and personal time,Academic,Medium,3 months,"productivity,organization,skills"
10,Study Partner Pro,Join study group,Collaborate with peers for academic success,Academic,Easy,3 months,"study,collaboration,academic"
11,Conference Presenter,Present at conference,Share research or project at academic event,Academic,Hard,1 year,"research,presentation,achievement"
12,Honor Society Member,Join academic honor society,Earn membership in scholastic organization,Academic,Medium,3 months,"achievement,academic,recognition"
13,MOOC Completer,Complete online course,Finish MOOC or additional learning program,Academic,Medium,3 months,"learning,skills,education"
14,Internship Hunter,Secure an internship,Find and obtain relevant work experience,Career,Medium,3 months,"career,internship,professional"
15,Portfolio Builder,Build a professional portfolio,Create showcase of work and achievements,Career,Medium,6 months,"career,portfolio,professional"
16,Workshop Warrior,Attend career workshops,Participate in professional development events,Career,Easy,3 months,"career,learning,professional"
17,Resume Revamp,Update resume and LinkedIn,Improve professional online presence,Career,Easy,1 week,"career,branding,professional"
18,Interview Master,Learn interview skills,Practice and improve interview techniques,Career,Medium,1 month,"career,skills,professional"
19,Career Explorer,Identify career path,Explore and decide on professional direction,Career,Medium,3 months,"career,exploration,planning"
20,Skill-Up Scholar,Develop technical skills,Learn job-specific tools or software,Career,Medium,6 months,"skills,career,technology"
21,Mentee Match,Find a mentor,Connect with professional for guidance,Career,Medium,3 months,"mentorship,career,networking"
22,Network Newbie,Attend networking events,Participate in career fairs and mixers,Career,Easy,3 months,"networking,career,professional"
23,Certified Pro,Complete online certification,Earn credential in relevant field,Career,Medium,3 months,"education,certification,career"
24,Volunteer Champion,Volunteer regularly,Contribute time to community service,Community,Medium,3 months,"volunteering,community,service"
25,Event Organizer,Organize campus event,Plan and execute student activity,Community,Hard,3 months,"leadership,event planning,community"
26,Peer Mentor,Mentor younger students,Provide guidance to underclassmen,Community,Medium,3 months,"mentorship,leadership,service"
27,Eco Warrior,Join environmental initiative,Participate in sustainability efforts,Community,Easy,3 months,"environment,activism,community"
28,Club Founder,Start a student organization,Create new campus group or club,Community,Hard,1 year,"leadership,community,organization"
29,Blood Donor,Participate in blood drive,Donate blood regularly,Community,Easy,3 months,"community,service,health"
30,Local Supporter,Support local businesses,Shop and eat locally when possible,Community,Easy,Ongoing,"community,local,support"
31,Culture Connector,Join cultural organization,Connect with cultural or ethnic student groups,Community,Easy,3 months,"culture,community,identity"
32,Cause Advocate,Raise awareness for cause,Advocate for important issue,Community,Medium,3 months,"activism,advocacy,community"
33,Campus Connector,Build campus connections,Get to know professors and staff,Community,Easy,3 months,"networking,relationships,academic"
34,Music Maker,Learn a musical instrument,Develop musical skills and practice regularly,Creative,Hard,1 year,"music,creativity,skills"
35,Project Lead,Start a creative project,Begin blog podcast art series etc.,Creative,Medium,6 months,"creativity,project,expression"
36,Word Wizard,Improve writing skills,Enhance creative or academic writing,Creative,Medium,6 months,"writing,creativity,skills"
37,Lens Master,Learn photography,Develop photography skills and techniques,Creative,Medium,6 months,"photography,creativity,art"
38,Stage Star,Join a performance group,Participate in dance theater or music ensemble.,Creative,Medium,3 months,"performance,creativity,social"
39,Art Adventurer,Start painting or drawing,Develop visual art skills,Creative,Medium,6 months,"art,creativity,skills"
40,Video Virtuoso,Learn video editing,Develop multimedia creation skills,Creative,Medium,3 months,"technology,creativity,skills"
41,Story Teller,Write a short story or novel,Complete creative writing project,Creative,Hard,1 year,"writing,creativity,project"
42,Web Designer,Design personal website,Create online portfolio or blog,Creative,Medium,1 month,"technology,creativity,branding"
43,Design Apprentice,Learn graphic design,Develop design skills and software knowledge,Creative,Medium,6 months,"design,creativity,technology"
44,Budget Boss,Create and stick to a budget,Develop financial planning habits,Financial,Medium,3 months,"finance,budgeting,money management"
45,Savings Superstar,Save money regularly,Build savings and emergency fund,Financial,Medium,1 year,"savings,finance,money management"
46,Debt Destroyer,Reduce debt,Pay down student loans or credit card debt,Financial,Hard,1 year,"finance,debt,money management"
47,Investment Initiate,Learn about investing,Understand basic investment principles,Financial,Medium,3 months,"finance,investing,financial literacy"
48,Job Seeker,Find part-time job,Secure employment while studying,Financial,Medium,1 month,"work,income,employment"
49,Expense Tracker,Track expenses daily,Monitor spending habits consistently,Financial,Easy,3 months,"budgeting,awareness,finance"
50,Spending Cutter,Cut unnecessary expenses,Identify and eliminate wasteful spending,Financial,Medium,3 months,"budgeting,finance,savings"
51,Scholarship Seeker,Apply for scholarships,Seek financial aid opportunities,Financial,Medium,3 months,"finance,scholarships,opportunity"
52,Financial Fitness,Learn financial literacy,Understand personal finance basics,Financial,Easy,3 months,"education,finance,money management"
53,Side Hustler,Start a side hustle,Create additional income stream,Financial,Hard,6 months,"entrepreneurship,income,finance"
54,Gym Regular,Exercise regularly,Build a consistent workout routine,Health & Fitness,Medium,3 months,"fitness,health,exercise"
55,Transformation Tracker,Lose weight,Achieve healthy weight loss goals,Health & Fitness,Medium,6 months,"fitness,nutrition,health"
56,Muscle Builder,Build muscle,Increase muscle mass through strength training,Health & Fitness,Medium,6 months,"fitness,strength,health"
57,Sleep Schedule Savior,Improve sleep schedule,Develop healthy sleep habits and routines,Health & Fitness,Easy,1 month,"wellness,sleep,health"
58,Meal Prep Master,Eat healthier,Improve nutritional choices and meal planning,Health & Fitness,Medium,3 months,"nutrition,health,wellness"
59,5K Runner,Run a 5K/10K,Train for and complete a running race,Health & Fitness,Medium,6 months,"fitness,running,achievement"
60,Sports Explorer,Try a new sport,Explore different athletic activities,Health & Fitness,Easy,3 months,"sports,fitness,exploration"
61,Flexibility Focus,Improve flexibility,Work on stretching and mobility,Health & Fitness,Medium,3 months,"fitness,flexibility,wellness"
62,Hydration Hero,Stay hydrated,Drink adequate water daily,Health & Fitness,Easy,1 month,"health,wellness,habits"
63,Smoke-Free Champion,Quit smoking/vaping,Eliminate tobacco or nicotine use,Health & Fitness,Hard,6 months,"health,wellness,habits"
64,Yogi in Training,Practice yoga regularly,Develop consistent yoga practice,Health & Fitness,Easy,3 months,"wellness,fitness,mindfulness"
65,Mindful Drinker,Limit alcohol consumption,Drink less or abstain from alcohol,Health & Fitness,Medium,6 months,"health,wellness,habits"
66,Language Learner,Learn a new language,Gain conversational proficiency in foreign language,Language,Hard,1 year,"language,learning,cultural"
67,English Enhancer,Improve English skills,Enhance academic or professional English,Language,Medium,3 months,"language,communication,academic"
68,Public Speaking Pro,Practice public speaking,Develop presentation and speaking abilities,Language,Medium,6 months,"communication,speaking,skills"
69,Debate Dynamo,Join debate team,Improve argumentation and speaking skills,Language,Medium,3 months,"debate,speaking,skills"
70,Daily Writer,Write regularly,Develop writing habit through journaling or blogging,Language,Easy,3 months,"writing,expression,habits"
71,Literary Explorer,Read books in target language,Improve language through literature,Language,Medium,3 months,"language,reading,learning"
72,Exchange Partner,Find language exchange partner,Practice with native speaker,Language,Easy,3 months,"language,practice,cultural"
73,Film Buff,Watch foreign films,Improve listening skills through media,Language,Easy,3 months,"language,culture,entertainment"
74,Toastmaster Trainee,Join Toastmasters or speaking club,Practice public speaking regularly,Language,Medium,3 months,"speaking,confidence,communication"
75,Vocab Builder,Expand vocabulary,Learn new words daily,Language,Easy,3 months,"language,learning,communication"
76,Early Bird,Wake up earlier,Develop early morning routine,Lifestyle,Medium,1 month,"habits,productivity,lifestyle"
77,Digital Detoxer,Reduce screen time,Limit phone and social media usage,Lifestyle,Medium,3 months,"wellness,habits,digital detox"
78,Kitchen Hero,Cook more meals at home,Learn cooking and meal preparation,Lifestyle,Easy,3 months,"cooking,health,life skills"
79,Routine Rockstar,Develop a morning routine,Create consistent start-of-day habits,Lifestyle,Easy,1 month,"habits,productivity,wellness"
80,Gratitude Guru,Practice gratitude daily,Maintain gratitude journal or practice,Lifestyle,Easy,3 months,"wellness,mindfulness,positivity"
81,Minimalist Maven,Minimize possessions,Adopt minimalist lifestyle approach,Lifestyle,Medium,6 months,"minimalism,lifestyle,organization"
82,Night Routine Ninja,Develop evening routine,Create consistent end-of-day habits,Lifestyle,Easy,1 month,"habits,wellness,routine"
83,Caffeine Cutter,Reduce caffeine intake,Cut back on coffee or energy drinks,Lifestyle,Medium,1 month,"health,habits,wellness"
84,Sustainability Starter,Practice sustainable living,Adopt eco-friendly habits,Lifestyle,Medium,6 months,"environment,lifestyle,sustainability"
85,Time Blocker,Learn time blocking,Implement structured scheduling method,Lifestyle,Easy,1 month,"productivity,time management,organization"
86,Zen Seeker,Reduce stress and anxiety,Learn stress management techniques,Mental Health,Medium,3 months,"wellness,mental health,self-care"
87,Mindfulness Beginner,Practice mindfulness,Develop regular meditation or mindfulness practice,Mental Health,Easy,1 month,"meditation,wellness,mental health"
88,EQ Champion,Improve emotional intelligence,Better understand and manage emotions,Mental Health,Medium,6 months,"self-awareness,growth,emotional skills"
89,Confidence Cultivator,Build self-confidence,Work on self-esteem and confidence,Mental Health,Medium,6 months,"personal growth,confidence,self-improvement"
90,Action Taker,Overcome procrastination,Develop strategies to combat procrastination,Mental Health,Medium,3 months,"productivity,habits,time management"
91,Therapy Advocate,Start therapy or counseling,Seek professional mental health support,Mental Health,Medium,Ongoing,"mental health,support,wellness"
92,Coping Toolkit Builder,Develop coping strategies,Build toolkit for managing difficult emotions,Mental Health,Medium,6 months,"mental health,coping,wellness"
93,Self-Love Student,Practice self-compassion,Be kinder to yourself,Mental Health,Medium,3 months,"self-care,mental health,growth"
94,Boundary Setter,Set healthy boundaries,Learn to say no and prioritize self,Mental Health,Medium,3 months,"boundaries,self-care,relationships"
95,Journal Keeper,Journal regularly,Maintain reflective writing practice,Mental Health,Easy,3 months,"reflection,writing,mental health"
96,Social Butterfly,Make new friends,Expand social circle and build connections,Social,Easy,3 months,"friendship,networking,social"
97,Communication Ace,Improve communication skills,Enhance verbal and interpersonal communication,Social,Medium,3 months,"communication,social skills,personal development"
98,Campus Explorer,Join a club or organization,Become active in campus community,Social,Easy,1 month,"involvement,community,social"
99,Networking Navigator,Network professionally,Build career-related connections,Social,Medium,3 months,"career,networking,professional"
100,Leadership Legend,Develop leadership skills,Take on leadership roles and responsibilities,Social,Hard,1 year,"leadership,growth,skills"
101,Active Listener,Improve active listening,Become better at truly hearing others,Social,Medium,3 months,"communication,empathy,social skills"
102,Reconnection Specialist,Reconnect with old friends,Reach out to past connections,Social,Easy,1 month,"friendship,relationships,social"
103,Event Enthusiast,Attend more social events,Say yes to invitations and gatherings,Social,Easy,3 months,"social,networking,experience"
104,Small Talk Specialist,Learn small talk skills,Get better at casual conversation,Social,Easy,1 month,"communication,social skills,confidence"
105,Study Buddy Finder,Find a study partner,Connect with someone for mutual academic support,Social,Easy,1 month,"study,collaboration,social"